rank,asin,title,brand,price,unit_price,count,rating,review_count,timestamp
1,B07DX89ZHN,Sports Research® Omega-3 Fish Oil 1250 - Triple Strength Fish Oil Supplement from Wild Alaska Pollock - MSC Certified Sustainable · Non-GMO · Soy Free - 90 Softgel Capsules,Sports Research,19.56,0.2173,90,4.7,60455,2026-06-26T02:12:55Z
2,B0739KKHWL,"Nordic Naturals Ultimate Omega, Lemon Flavor - 90 Soft Gels - 1280 mg Omega-3 - High-Potency Omega-3 Fish Oil Supplement with EPA & DHA - Promotes Brain & Heart Health - Non-GMO - 45 Servings",Nordic Naturals,33.75,0.375,90,4.7,58980,2026-06-26T02:12:55Z
3,B000NPYY04,"Nature's Bounty Fish Oil Omega 3 Supplements - Supports Heart Health, 1200 Mg Fish Oil, Omega-3, 200 Softgels (Pack of 1)",Nature's Bounty,11.4,0.057,200,4.7,75515,2026-06-26T02:12:55Z
4,B01NBTJFJB,Triple Strength Omega 3 Fish Oil 3600 mg | EPA & DHA | Over 2100mg Omega-3 Fatty Acids | 1300mg EPA + 860mg DHA | Best Essential Fatty Acids | Premium Wild Caught & Burpless Fish Oil | 120 Ct,,27.71,0.2309,120,4.6,29810,2026-06-26T02:12:55Z
5,B0C5F59RWG,NatureWise Extra-Strength Omega 3 Fish Oil Supplement - 1000mg per Serving - 600 EPA & 400 DHA and Vitamin E - Sustainably Sourced Fish Oil - Lemon Flavor - 60 Softgels[1-Month Supply],NatureWise,7.59,0.1265,60,4.7,9478,2026-06-26T02:12:55Z
6,B071VT9J98,"Nature Made Fish Oil Omega 3 Supplements, 1200 mg Softgels, Omega 3 Fish Oil for Healthy Heart Support, 230 Softgels, 115 Day Supply",Nature Made,15.33,0.0667,230,4.8,11058,2026-06-26T02:12:55Z
7,B075ZTY6GR,"Nordic Naturals Omega-3, Lemon Flavor - 90 Soft Gels - 690 mg Omega-3 - Fish Oil - EPA & DHA - Immune Support, Brain & Heart Health, Optimal Wellness - Non-GMO - 45 Servings",Nordic Naturals,22.49,0.2499,90,4.7,13435,2026-06-26T02:12:55Z
8,B0184SMS9A,"MegaRed Antarctic Krill Oil 500mg Omega 3 Fatty Acid Supplement, Extra Strength EPA & DHA Krill Oil Softgels (90cnt Box), Astaxanthin, Heart Health Supplement with No Fish Oil Aftertaste",MegaRed,21.73,,,4.8,8034,2026-06-26T02:12:55Z
9,B014LDT0ZM,"Triple Strength Omega 3 Fish Oil Supplement for Men and Women – 2500 mg High-Potency, Easy-to-Absorb Re-esterified Triglyceride Form, Pescatarian-Friendly DPA EPA DHA Omega 3 Supplement, 180 Softgels",,53.95,0.2997,180,4.7,14061,2026-06-26T02:12:55Z
11,B07BBNGPG2,"Amazon Basics Fish Oil 303 mg, Soft Chew Gummies, Lemon, Orange & Strawberry-Banana Flavors, 90 Count, EPA and DHA Omega-3 Fatty Acids (Previously Solimo)",Amazon Basics,5.68,0.0631,90,4.6,8789,2026-06-26T02:12:55Z
12,B002QMB55Y,"Nature's Bounty Odorless Fish Oil, 1200mg Omega-3 per Serving Including EPA & DHA, Supports Heart Health, Purified to Eliminate Mercury, Coated Softgels, Gluten Free, No Shellfish, 90 Ct",Nature's Bounty,12.34,0.1371,90,4.7,9860,2026-06-26T02:12:55Z
14,B0046XC528,"Nature Made Fish Oil Omega 3 Supplements, 1000mg Softgels, Omega 3 Fish Oil for Healthy Heart Support, 250 Softgels, 125 Day Supply",Nature Made,19.59,0.0784,250,4.8,47507,2026-06-26T02:12:55Z
15,B00IP1E3O0,"Sports Research Krill Oil Supplement with EPA & DHA Omega 3, Phospholipids & Astaxanthin from Antarctic Krill - Highest Concentration of Krill Oil for Men & Women - 1000mg, 60 Softgel Capsules",Sports Research,21.66,0.361,60,4.7,11943,2026-06-26T02:12:55Z
16,B001GCU6KA,"NOW Foods Supplements, Omega-3 180 EPA / 120 DHA, Molecularly Distilled, Cardiovascular Support*, 200 Softgels",NOW Foods,14.27,0.0713,200,4.7,16390,2026-06-26T02:12:55Z
17,B0D81KQQ1L,"Nordic Naturals Zero Sugar Children’s DHA Gummy Chews, Tropical Punch - 45 Gummy Chews for Kids - 600 mg Total Omega-3s - Brain Development, Learning, Healthy Immunity - Non-GMO - 45 Servings",Nordic Naturals,28.01,0.6224,45,4.5,5323,2026-06-26T02:12:55Z
19,B098KLWZHN,"Nutricost Omega 3 Fish Oil - 2500MG, 120 Softgels (40 Serv) - Fish Oil, Wild Caught! 1200mg EPA 850mg DHA - Non-GMO, Gluten Free",Nutricost,20.95,0.1746,120,4.7,3411,2026-06-26T02:12:55Z
20,B07L45XQBR,"Micro Ingredients Triple Strength Omega 3 Fish Oil Supplements 4200mg Per Serving, 240 Softgels – Lemon Flavored – Burpless | EPA 1200mg + DHA 900mg | Deep Sea Fish",,28.89,0.1204,240,4.6,10865,2026-06-26T02:12:55Z
21,B0842DJJYC,Sports Research Vegan Omega-3 Fish Oil Alternative from Algae Oil - Highest Levels of Vegan DHA & EPA Fatty Acids | Non-GMO Tested & Vegan Certified - 60 Veggie Softgels (Carrageenan Free),Sports Research,18.86,,,4.6,4852,2026-06-26T02:12:55Z
22,B0018CJ17W,"THORNE - Super EPA - Omega-3 Fish Oil Supplement with EPA & DHA from Sustainably Sourced Fish - Supports Brain, Skin, Joint & Heart Health* - Third-Party Certified - Gluten & Dairy-Free - 90 Softgels",Thorne,41.0,0.4556,90,4.6,3101,2026-06-26T02:12:55Z
23,B0DNBL1D2J,"Fatty15 C15:0 Pentadecanoic Acid Healthy Aging Supplement - 3 Month Supply - 3X Cellular Benefits of Omega 3 Fish Oil - Longevity, Metabolic, Wellness & Liver Support - Gluten Free & Sugar Free",,119.96,,,4.3,772,2026-06-26T02:12:55Z
24,B06XPPP4M2,"Nordic Naturals Ultimate Omega 2X, Lemon Flavor - 120 Soft Gels - 2150 mg Omega-3 - High-Potency Fish Oil with EPA & DHA - Promotes Brain & Heart Health - Non-GMO - 60 Servings",Nordic Naturals,83.26,0.6938,120,4.6,5908,2026-06-26T02:12:55Z
25,B005N0RGQI,"Nature's Bounty Mini Fish Oil Softgels, Burpless Fish Oil Omega 3 Supplements, Supports Heart Health, 90 Softgels (Pack of 1)",Nature's Bounty,12.34,0.1371,90,4.6,8557,2026-06-26T02:12:55Z
26,B003B3P4PO,"Carlson - Cod Liver Oil 1100 mg Omega-3s Plus Vitamins A & D3, Wild Caught Norwegian Arctic, Sustainably Sourced Nordic Fish Oil Liquid, Lemon, 500 mL (16.9 Fl Oz)",Carlson,42.39,,,4.8,11978,2026-06-26T02:12:55Z
27,B00XWBFA7C,"Metagenics OmegaGenics Omega-3 Fish Oil 1000mg EPA DHA -High Potency Omega 3 Supplement for Heart, Brain & Joint Health-Sustainably Sourced- 120 Softgels",Metagenics,58.0,0.4833,120,4.7,1604,2026-06-26T02:12:55Z
29,B09SRB8BXP,"Nature Made Extra Strength Burp Less Fish Oil Omega 3 Supplements 1400 mg Minis, Omega 3 Fish Oil as Ethyl Esters for Healthy Heart Brain Eyes Support, 60 Softgels, 30 Day Supply",Nature Made,13.49,0.2248,60,4.6,4985,2026-06-26T02:12:55Z
30,B002CQU550,"Nordic Naturals Ultimate Omega-D3, Lemon Flavor - 120 Soft Gels - 1280 mg Omega-3 + 1000 IU Vitamin D3 - EPA & DHA - Promotes Brain, Heart, & Immune Health - 60 Servings",Nordic Naturals,42.99,0.3583,120,4.7,8210,2026-06-26T02:12:55Z
