rank,asin,title,brand,price,unit_price,count,rating,review_count,timestamp
51,B01LTHMG4A,"Nordic Naturals Ultimate Omega + CoQ10, Lemon - 120 Soft Gels - 1280 mg Omega-3 + 100 mg CoQ10 - Heart Health, Cellular Energy, Antioxidant Support - Non-GMO - 60 Servings",Nordic Naturals,59.8,0.4983,120,4.8,3237,2026-04-13T01:29:47Z
53,B0842DJJYC,Sports Research Vegan Omega-3 Fish Oil Alternative from Algae Oil - Highest Levels of Vegan DHA & EPA Fatty Acids | Non-GMO Tested & Vegan Certified - 60 Veggie Softgels (Carrageenan Free),Sports Research,26.95,,,4.6,4787,2026-04-13T01:29:47Z
54,B005D0DSLA,"Vitafusion Omega-3 Gummy Vitamins, Berry Lemonade Flavored, Heart Health Vitamins(1) With Omega 3 EPA/DHA and Vitamins A, C, D and E, America’s Number 1 Vitamin Brand, 60 Day Supply, 120 Count",,11.99,0.0999,120,4.6,12337,2026-04-13T01:29:47Z
55,B01DCHM1UE,"Megared Omega-3 Fish Oil + High Absorption Krill Oil 500mg Softgels, MegaRed Advanced 4in1 (80 count in a bottle) Concentrated Omega-3 Fish & Krill Oil Supplement",MegaRed,29.97,0.3746,80,4.7,13318,2026-04-13T01:29:47Z
56,B081VWWGCZ,"Carlson - Elite Omega-3 Gems, 1600 mg Omega-3 Fatty Acids Including EPA and DHA, Norwegian, Wild-Caught Fish Oil Supplement, Sustainably Sourced Omega 3 Fish Oil Capsules, Lemon, 130 Softgels",Carlson,42.42,0.3263,130,4.8,2104,2026-04-13T01:29:47Z
57,B07BH41QJQ,Pure Encapsulations EPA/DHA Essentials - Fish Oil Concentrate Supplement to Support Cardiovascular Health - Premium EPA & DHA Supplement with Omega 3-90 Softgel Capsules,Pure Encapsulations,41.5,0.4611,90,4.7,1621,2026-04-13T01:29:47Z
58,B07GSGWZMB,"Carlyle Antarctic Krill Oil 2000mg | 120 Softgels | Omega-3 EPA, DHA, with Astaxanthin Supplement Sourced from Red Krill | Maximum Strength | Laboratory Tested",Carlyle,19.78,0.1648,120,4.5,20381,2026-04-13T01:29:47Z
59,B09GYWZ2LP,"Icelandic Wild Caught Cod Liver Oil Softgels - Fish Omega 3, EPA, DHA, Vitamin D & A, 1000mg Per Serving - Burpless Capsules for Heart, Joint, Brain & Immune Support - 100 Count",Icelandic,17.99,0.1799,100,4.7,3867,2026-04-13T01:29:47Z
60,B0B523YQS7,"Qunol Fish Oil Omega 3 Mini Softgels, 1000mg Omega 3 EPA + DHA, Ultra Pure Supplements, Heart Health Support, Lemon Flavor, Easy to Swallow Minis, 3 Month Supply, 180 Count",Qunol,25.99,0.1444,180,4.6,4737,2026-04-13T01:29:47Z
61,B00014D08Y,"Carlson - Cod Liver Oil, 1100 mg Omega-3s, Liquid Fish Oil Supplement, Wild-Caught Norwegian Arctic, Sustainably Sourced Nordic Liquid, Lemon, 250 ml",Carlson,31.37,,,4.8,11898,2026-04-13T01:29:47Z
62,B0758338B2,"Nordic Naturals Ultimate Omega 2X Teen, Strawberry - 60 Mini Soft Gels - 1120 mg Total Omega-3s with EPA & DHA - Brain Health, Positive Mood, Social Development, Learning - Non-GMO - 30 Servings",Nordic Naturals,31.41,1.047,30,4.7,2474,2026-04-13T01:29:47Z
63,B00UG078PE,"Metagenics OmegaGenics EPA-DHA 1000 mg - High Potency Omega-3 Fish Oil Supplement for Heart, Brain & Joint Health* - Sustainably Sourced - 60 Softgels",Metagenics,48.75,0.8125,60,4.6,1503,2026-04-13T01:29:47Z
64,B00N55ASK4,"Barlean's Organic Flaxseed Oil Liquid from Fresh Cold Pressed Flax Seeds, 7,640mg ALA Omega 3 Fatty Acid Supplement for Skin and Hair Care, Vegan & Gluten Free, 8 oz",Barlean's,13.04,,,4.6,12544,2026-04-13T01:29:47Z
65,B08NXT9T9M,"Bronson Antarctic Krill Oil 2000 mg with Omega-3s EPA, DHA, Astaxanthin and Phospholipids 120 Softgels (60 Servings)",Bronson,19.97,0.1664,120,4.6,6780,2026-04-13T01:29:47Z
66,B0CVTNMFSK,"Micro Ingredients Omega 3 Fish Oil Supplements 3,000mg Per Serving, 240 Softgels | Lemon Flavored – Burpless | EPA 540mg + DHA 360mg | Deep Sea Fish",,19.19,0.08,240,4.7,1597,2026-04-13T01:29:47Z
67,B0714CYKXR,"Nature Made Fish Oil Omega 3 Supplements, Omega 3 Fish Oil as Ethyl Esters 1200 mg Softgels, EPA DHA Supplement for Healthy Heart, Brain, Eye Support, One Per Day, 100 Softgels",Nature Made,12.69,0.1269,100,4.8,1898,2026-04-13T01:29:47Z
68,B003PGJM00,"Nature Made Triple Omega 3 6 9 Supplements, Flaxseed, Safflower & Olive Oils, Fish Free Omega 3 Fatty Acid Supplement, 150 Softgels, 75 Day Supply",Nature Made,27.99,0.1866,150,4.7,10072,2026-04-13T01:29:47Z
69,B07H9GL3Y8,"Freshfield Vegan Omega 3, Algae (Algal) Oil, Fish Oil Free Company, Third Party Tested, Carrageenan Free, DHA Supplement w/DPA, Plant Based Omega. Supports Heart, Brain, Joint Health",Freshfield,25.99,,,4.6,10710,2026-04-13T01:29:47Z
70,B076ZXJZ6G,"Prime Natural Organic Black Seed Oil 4oz - Cold Pressed Unrefined High Thymoquinone 1.7% USDA Certified - Turkish Origin Potent Nigella Sativa Liquid - Vegan Omega 3 6 9, Antioxidant",,19.99,,,4.5,12841,2026-04-13T01:29:47Z
72,B006P4B43W,"Life Extension Super Omega-3 EPA/DHA Fish Oil, Sesame Lignans & Olive Extract – Heart Health, Brain Health, Inflammation Health Support, Gluten-Free, Easy to Swallow, Non-GMO, 240 Softgels",Life Extension,27.75,0.1156,240,4.5,5395,2026-04-13T01:29:47Z
73,B01EVITLHE,Purity Products Omega 3-6-9 Vegan and Vegetarian Formula - “5 in 1” Essential Fatty Acid Complex - Scientifically Formulated Plant-Based Omega 3 6 9 Essential Fatty Acids (EFA) - from (60),Purity Products,15.95,,,4.7,4638,2026-04-13T01:29:47Z
74,B01MCWCO2Y,"Bronson Antarctic Krill Oil 1000 mg with Omega-3s EPA, DHA, Astaxanthin and Phospholipids 120 Softgels",Bronson,27.99,0.2332,120,4.6,14934,2026-04-13T01:29:47Z
75,B000SE5SY6,"NOW Foods Supplements, Ultra Omega-3 Molecularly Distilled and Enteric Coated, 180 Softgels",NOW Foods,17.4,0.0967,180,4.8,4076,2026-04-13T01:29:47Z
76,B00126FELQ,"Nature Made Flaxseed Oil 1000 mg, Fish Free Omega 3 Supplement, Dietary Supplement for Heart Health Support, 100 Softgels, 100 Day Supply",Nature Made,12.89,0.1289,100,4.7,7699,2026-04-13T01:29:47Z
77,B001LF39RE,"Carlson - The Very Finest Fish Oil, 1600 mg Omega-3s, Liquid Fish Oil Supplement, Norwegian Fish Oil, Wild-Caught, Sustainably Sourced Fish Oil Liquid, Lemon, 200ml, 6.7 Fl Oz",Carlson,29.67,,,4.7,7357,2026-04-13T01:29:47Z
78,B07VF9HB74,"Nordic Naturals DHA Xtra, Strawberry - 90 Soft Gels - 1660 mg Omega-3 - High-Intensity DHA Formula for Brain & Nervous System Support - Non-GMO - 45 Servings",Nordic Naturals,39.06,0.434,90,4.7,3581,2026-04-13T01:29:47Z
79,B0FLXXL41Q,"Pumpkin Seed Oil with Saw Palmetto, 3500mg Max Strength per Serving, 150 Softgels, Cold-Pressed with Essential Fatty Acids & Phytosterols, Supports Immune, Hair, Bladder & Prostate Health",,18.99,0.1266,150,4.5,475,2026-04-13T01:29:47Z
80,B0CXZHJXHV,"Nature's Bounty Omega 3, Plant-Based Omega 3 Fatty Acid Supplement, 520mg, Supports Whole Body Health Including Heart, Skin, Joint, 30 Vegetarian Softgels, Fish Oil Alternative",Nature's Bounty,13.79,,,4.7,513,2026-04-13T01:29:47Z
