rank,asin,title,brand,price,unit_price,count,rating,review_count,timestamp
1,B0739KKHWL,"Nordic Naturals Ultimate Omega, Lemon Flavor - 90 Soft Gels - 1280 mg Omega-3 - High-Potency Omega-3 Fish Oil Supplement with EPA & DHA - Promotes Brain & Heart Health - Non-GMO - 45 Servings",Nordic Naturals,33.3,0.37,90,4.7,58500,2026-05-17T02:01:36Z
2,B07DX89ZHN,Sports Research® Omega-3 Fish Oil 1250 - Triple Strength Fish Oil Supplement from Wild Alaska Pollock - MSC Certified Sustainable · Non-GMO · Soy Free - 90 Softgel Capsules,Sports Research,27.95,0.3106,90,4.7,59455,2026-05-17T02:01:36Z
3,B000NPYY04,"Nature's Bounty Fish Oil Omega 3 Supplements - Supports Heart Health, 1200 Mg Fish Oil, Omega-3, 200 Softgels (Pack of 1)",Nature's Bounty,14.17,0.0708,200,4.7,74976,2026-05-17T02:01:36Z
4,B01NBTJFJB,Triple Strength Omega 3 Fish Oil 3600 mg | EPA & DHA | Over 2100mg Omega-3 Fatty Acids | 1300mg EPA + 860mg DHA | Best Essential Fatty Acids | Premium Wild Caught & Burpless Fish Oil | 120 Ct,,34.95,0.2913,120,4.6,29313,2026-05-17T02:01:36Z
5,B071VT9J98,"Nature Made Fish Oil Omega 3 Supplements, 1200 mg Softgels, Omega 3 Fish Oil for Healthy Heart Support, 230 Softgels, 115 Day Supply",Nature Made,18.39,0.08,230,4.8,10849,2026-05-17T02:01:36Z
6,B0C5F59RWG,"NatureWise Extra-Strength Omega 3 Fish Oil Supplement - 1000mg per Serving - 600 EPA & 400 DHA and Vitamin E - Support for Heart & Brain Health - Lemon Flavor, GMO-Free - 60 Softgels[1-Month Supply]",NatureWise,8.02,0.1337,60,4.7,8901,2026-05-17T02:01:36Z
7,B014LDT0ZM,"Triple Strength Omega 3 Fish Oil Supplement for Men and Women – 2500 mg High-Potency, Easy-to-Absorb Re-esterified Triglyceride Form, Pescatarian-Friendly DPA EPA DHA Omega 3 Supplement, 180 Softgels",,55.9,0.3106,180,4.7,13808,2026-05-17T02:01:36Z
8,B098KLWZHN,"Nutricost Omega 3 Fish Oil - 2500MG, 120 Softgels (40 Serv) - Fish Oil, Wild Caught! 1200mg EPA 850mg DHA - Non-GMO, Gluten Free",Nutricost,19.95,0.1662,120,4.7,3147,2026-05-17T02:01:36Z
9,B01BHF3KRG,"Micro Ingredients Pumpkin Seed Oil with Saw Palmetto,300 Softgels | Cold Pressed, Pure Virgin Oil, Essential Fatty Acids, & Phytosterols | Non-GMO",,34.95,0.1165,300,4.5,5151,2026-05-17T02:01:36Z
10,B0184SMS9A,"MegaRed Antarctic Krill Oil 500mg Omega 3 Fatty Acid Supplement, Extra Strength EPA & DHA Krill Oil Softgels (90cnt Box), Astaxanthin, Heart Health Supplement with No Fish Oil Aftertaste",MegaRed,22.32,,,4.8,7895,2026-05-17T02:01:36Z
11,B075ZTY6GR,"Nordic Naturals Omega-3, Lemon Flavor - 90 Soft Gels - 690 mg Omega-3 - Fish Oil - EPA & DHA - Immune Support, Brain & Heart Health, Optimal Wellness - Non-GMO - 45 Servings",Nordic Naturals,22.49,0.2499,90,4.7,13236,2026-05-17T02:01:36Z
13,B0018CJ17W,"THORNE - Super EPA - Omega-3 Fish Oil Supplement with EPA & DHA from Sustainably Sourced Fish - Supports Brain, Skin, Joint & Heart Health* - Third-Party Certified - Gluten & Dairy-Free - 90 Softgels",Thorne,41.0,0.4556,90,4.6,2995,2026-05-17T02:01:36Z
14,B07BBNGPG2,"Amazon Basics Fish Oil 303 mg, Soft Chew Gummies, Lemon, Orange & Strawberry-Banana Flavors, 90 Count, EPA and DHA Omega-3 Fatty Acids (Previously Solimo)",Amazon Basics,10.79,0.1199,90,4.6,8685,2026-05-17T02:01:36Z
15,B001GCU6KA,"NOW Foods Supplements, Omega-3 180 EPA / 120 DHA, Molecularly Distilled, Cardiovascular Support*, 200 Softgels",NOW Foods,14.69,0.0735,200,4.7,16058,2026-05-17T02:01:36Z
16,B06XPPP4M2,"Nordic Naturals Ultimate Omega 2X, Lemon Flavor - 120 Soft Gels - 2150 mg Omega-3 - High-Potency Fish Oil with EPA & DHA - Promotes Brain & Heart Health - Non-GMO - 60 Servings",Nordic Naturals,81.0,0.675,120,4.6,5782,2026-05-17T02:01:36Z
17,B07WMZTX28,"Nordic Naturals Zero Sugar Children’s DHA Gummy Chews, Tropical Punch - 30 Gummy Chews for Kids - 600 mg Total Omega-3s - Brain Development, Learning, Healthy Immunity - Non-GMO - 30 Servings",Nordic Naturals,17.67,0.589,30,4.5,5215,2026-05-17T02:01:36Z
18,B0FLXXL41Q,"Pumpkin Seed Oil with Saw Palmetto, 3500mg Max Strength per Serving, 150 Softgels, Cold-Pressed with Essential Fatty Acids & Phytosterols, Supports Immune, Hair, Bladder & Prostate Health",,18.99,0.1266,150,4.6,595,2026-05-17T02:01:36Z
19,B09SRB8BXP,"Nature Made Extra Strength Burp Less Fish Oil Omega 3 Supplements 1400 mg Minis, Omega 3 Fish Oil as Ethyl Esters for Healthy Heart Brain Eyes Support, 60 Softgels, 30 Day Supply",Nature Made,13.49,0.2248,60,4.6,4882,2026-05-17T02:01:36Z
20,B07L45XQBR,"Micro Ingredients Triple Strength Omega 3 Fish Oil Supplements 4200mg Per Serving, 240 Softgels – Lemon Flavored – Burpless | EPA 1200mg + DHA 900mg | Deep Sea Fish",,33.99,0.1416,240,4.6,10759,2026-05-17T02:01:36Z
21,B00YMSLAW8,"Nature Made Fish Oil Omega 3 Supplements, 1000 mg Softgels, Omega 3 Fish Oil for Healthy Heart Support, 90 Softgels, 45 Day Supply",Nature Made,9.67,0.1074,90,4.8,47223,2026-05-17T02:01:36Z
24,B002CQU550,"Nordic Naturals Ultimate Omega-D3, Lemon Flavor - 120 Soft Gels - 1280 mg Omega-3 + 1000 IU Vitamin D3 - EPA & DHA - Promotes Brain, Heart, & Immune Health - 60 Servings",Nordic Naturals,46.0,0.3833,120,4.7,8160,2026-05-17T02:01:36Z
25,B084XWMRRW,"NOW Supplements, Pumpkin Seed Oil 1000 mg with Essential Fatty Acids and Phytosterols, Cold Pressed, 200 Softgels",,21.4,0.107,200,4.5,9936,2026-05-17T02:01:36Z
28,B002WTCLGI,"Nordic Naturals Children’s DHA, Strawberry - 8 oz for Kids - 530 mg Omega-3 with EPA & DHA - Brain Development & Function - Non-GMO - 96 Servings",Nordic Naturals,29.71,0.3095,96,4.6,10322,2026-05-17T02:01:36Z
29,B07V9NZX7N,"Nordic Naturals Ultimate Omega Jr., Strawberry - 120 Mini Soft Gels - 680 Total Omega-3s with EPA & DHA - Brain Health, Mood, Learning - Non-GMO - 60 Servings",Nordic Naturals,34.81,0.5802,60,4.7,5405,2026-05-17T02:01:36Z
30,B000J18RSW,"NOW Supplements, Omega-3 180 EPA / 120 DHA, Molecularly Distilled, Cardiovascular Support, 100 Softgels",,7.95,0.0795,100,4.8,6872,2026-05-17T02:01:36Z
26,B0842DJJYC,Sports Research Vegan Omega-3 Fish Oil Alternative from Algae Oil - Highest Levels of Vegan DHA & EPA Fatty Acids | Non-GMO Tested & Vegan Certified - 60 Veggie Softgels (Carrageenan Free),Sports Research,26.95,,,4.6,4816,2026-05-17T02:01:42Z
27,B07GSGWZMB,"Carlyle Antarctic Krill Oil 2000mg | 120 Softgels | Omega-3 EPA, DHA, with Astaxanthin Supplement Sourced from Red Krill | Maximum Strength | Laboratory Tested",Carlyle,19.78,0.1648,120,4.5,20429,2026-05-17T02:01:42Z
28,B01DCHM1UE,MegaRed Omega-3 Fish Oil + High Absorption Krill Oil 500mg Softgels (80 Count (Pack of 1)),MegaRed,26.64,0.333,80,4.7,13360,2026-05-17T02:01:42Z
29,B08NXT9T9M,"Bronson Antarctic Krill Oil 2000mg with Omega-3s EPA, DHA, Astaxanthin and Phospholipids 120 Softgels",Bronson,17.97,0.1497,120,4.6,6845,2026-05-17T02:01:42Z
30,B0B523YQS7,"Qunol Fish Oil Omega 3 Mini Softgels, 1000mg Omega 3 EPA + DHA, Ultra Pure Supplements, Heart Health Support, Lemon Flavor, Easy to Swallow Minis, 3 Month Supply, 180 Count",Qunol,25.99,0.1444,180,4.6,4824,2026-05-17T02:01:42Z
31,B081VWWGCZ,"Carlson - Elite Omega-3 Gems, 1600 mg Omega-3 Fatty Acids Including EPA and DHA, Norwegian, Wild-Caught Fish Oil Supplement, Sustainably Sourced Omega 3 Fish Oil Capsules, Lemon, 130 Softgels",Carlson,42.42,0.3263,130,4.8,2137,2026-05-17T02:01:42Z
32,B000SE5SY6,"NOW Foods Supplements, Ultra Omega-3 Molecularly Distilled and Enteric Coated, 180 Softgels",NOW Foods,21.19,0.1177,180,4.8,4152,2026-05-17T02:01:42Z
33,B006P4B43W,"Life Extension Super Omega-3 EPA/DHA Fish Oil, Sesame Lignans & Olive Extract – Heart Health, Brain Health, Inflammation Health Support, Gluten-Free, Easy to Swallow, Non-GMO, 240 Softgels",Life Extension,27.75,0.1156,240,4.5,5491,2026-05-17T02:01:42Z
34,B0758338B2,"Nordic Naturals Ultimate Omega 2X Teen, Strawberry - 60 Mini Soft Gels - 1120 mg Total Omega-3s with EPA & DHA - Brain Health, Positive Mood, Social Development, Learning - Non-GMO - 30 Servings",Nordic Naturals,31.41,1.047,30,4.7,2519,2026-05-17T02:01:42Z
35,B076CQXRND,"Zhou Organic Black Seed Oil - Black Cumin Seed Oil Cold Pressed, Nigella Sativa, Pure Unrefined Blackseed Liquid, Premium Supplement for Health with Thymoquinone, Omega 3 6 9 - 8 Fl Oz (Pack of 1)",Zhou,20.89,,,4.5,25000,2026-05-17T02:01:42Z
36,B00UG078PE,"Metagenics OmegaGenics Omega-3 Fish Oil 1000mg EPA DHA -High Potency Omega 3 Supplement for Heart, Brain & Joint Health-Sustainably Sourced- 60 Softgels",Metagenics,48.75,0.8125,60,4.7,1561,2026-05-17T02:01:42Z
37,B07BH41QJQ,Pure Encapsulations EPA/DHA Essentials - Fish Oil Concentrate Supplement to Support Cardiovascular Health - Premium EPA & DHA Supplement with Omega 3-90 Softgel Capsules,Pure Encapsulations,41.5,0.4611,90,4.7,1641,2026-05-17T02:01:42Z
39,B076ZXJZ6G,"Prime Natural Organic Black Seed Oil 4oz - Cold Pressed Unrefined High Thymoquinone 1.7% USDA Certified - Turkish Origin Potent Nigella Sativa Liquid - Vegan Omega 3 6 9, Antioxidant",,19.99,,,4.5,12964,2026-05-17T02:01:42Z
40,B092LLQ9DJ,"Momentous Omega-3 Fish Oil - High-Potency EPA & DHA Supplement for Men & Women - Supports Heart, Joint, & Brain Health - NSF Certified for Sport - Non-GMO - Gluten-Free - 1,600 mg - 30 Servings",,39.95,1.3317,30,4.6,439,2026-05-17T02:01:42Z
41,B01EVITLHE,Purity Products Omega 3-6-9 Vegan and Vegetarian Formula - “5 in 1” Essential Fatty Acid Complex - Scientifically Formulated Plant-Based Omega 3 6 9 Essential Fatty Acids (EFA) - from (60),Purity Products,15.95,,,4.7,4698,2026-05-17T02:01:42Z
42,B00014D08Y,"Carlson - Cod Liver Oil, 1100 mg Omega-3s, Liquid Fish Oil Supplement, Wild-Caught Norwegian Arctic, Sustainably Sourced Nordic Liquid, Lemon, 250 ml",Carlson,33.07,,,4.8,11943,2026-05-17T02:01:42Z
43,B001LF39RO,"Carlson - The Very Finest Fish Oil, 1600 mg Omega-3s, Liquid Supplement, Norwegian, Wild-Caught, Sustainably Sourced , Lemon, 16.9 Fl Oz",Carlson,59.42,,,4.7,7431,2026-05-17T02:01:42Z
44,B08SCHPNQM,"Oceanblue Professional Omega-3 2100 – 180 ct – Triple Strength Burpless Fish Oil Supplement with High-Potency EPA, DHA, DPA – Wild-Caught – Orange Flavor (90 Servings)",Oceanblue,49.95,0.2775,180,4.6,5879,2026-05-17T02:01:42Z
45,B08LR12HBM,"MARYRUTH'S Vegan Omega 3 Gummies for Kids 2+, 2 Month Supply, Sugar Free, Omega 3 Supplement with Vitamin C, Flaxseed Oil, Immune Support, Essential Nutrient ALA, No Fish Taste, 60 Count",,17.21,0.2868,60,4.6,1256,2026-05-17T02:01:42Z
46,B0FS5MPD63,"Nature Made Fish Oil Omega 3 Supplements, 2000mg Per Serving Softgels, Omega 3 Fish Oil for Healthy Heart Support, 250 Softgels, 125 Day Supply",Nature Made,29.59,0.1184,250,4.8,377,2026-05-17T02:01:42Z
47,B0013L5G9U,"Nature’s Bounty Fish Oil, Supports Heart Health, 1000mg, Rapid Release Softgels, 145 Ct",,11.97,0.0826,145,4.8,5850,2026-05-17T02:01:42Z
48,B0CXZHJXHV,"Nature's Bounty Omega 3, Plant-Based Omega 3 Fatty Acid Supplement, 520mg, Supports Whole Body Health Including Heart, Skin, Joint, 30 Vegetarian Softgels, Fish Oil Alternative",Nature's Bounty,13.79,,,4.7,591,2026-05-17T02:01:42Z
49,B07VP9B9GS,"Nordic Naturals Ultimate Omega + CoQ10, Lemon - 90 Soft Gels - 1280 mg Omega-3 + 100 mg CoQ10 - Heart Health, Cellular Energy, Antioxidant Support - Non-GMO - 45 Servings",Nordic Naturals,49.26,0.5473,90,4.8,3274,2026-05-17T02:01:42Z
50,B01MCWCO2Y,"Bronson Antarctic Krill Oil 1000 mg with Omega-3s EPA, DHA, Astaxanthin and Phospholipids 120 Softgels",Bronson,27.99,0.2332,120,4.6,14948,2026-05-17T02:01:42Z
51,B0B71Z69WK,"Livingood Daily Omega 3 6 9 Plus Turmeric Curcumin Supplement, 60 Softgels - Fish Oil Omega 3 Supplements (EPA & DHA) for Men and Women - Brain, Joint, Heart Health, and Metabolism - Made in USA",Livingood,39.95,0.6658,60,4.6,2273,2026-05-17T02:01:42Z
52,B0CL8BF5FR,"Ritual Vegan Omega 3 Supplement - Science-Backed Dose of DHA and EPA - Bioavailable Omega-3 from Algae Oil - Brain, Heart, and Eye Health Support** - Citrus - 30 Capsules - 30 Servings",,33.0,1.1,30,4.6,549,2026-05-17T02:01:42Z
53,B07VF9HB74,"Nordic Naturals DHA Xtra, Strawberry - 90 Soft Gels - 1660 mg Omega-3 - High-Intensity DHA Formula for Brain & Nervous System Support - Non-GMO - 45 Servings",Nordic Naturals,39.06,0.434,90,4.7,3603,2026-05-17T02:01:42Z
54,B07H9GL3Y8,"Freshfield Vegan Omega 3, Algae (Algal) Oil, Fish Oil Free Company, Third Party Tested, Carrageenan Free, DHA Supplement w/DPA, Plant Based Omega. Supports Heart, Brain, Joint Health",Freshfield,25.99,,,4.6,10742,2026-05-17T02:01:42Z
55,B00126FELQ,"Nature Made Flaxseed Oil 1000 mg, Fish Free Omega 3 Supplement, Dietary Supplement for Heart Health Support, 100 Softgels, 100 Day Supply",Nature Made,10.59,0.1059,100,4.7,7765,2026-05-17T02:01:42Z
