rank,asin,title,brand,price,unit_price,count,rating,review_count,timestamp
1,B07DX89ZHN,"Sports Research® Omega-3 Fish Oil 1250mg from Wild Alaska Pollock, 90 Count | Always Fresh Never Fishy, 690mg EPA & 260 DHA per Softgel, MSC Certified Sustainable, Heart & Brain Health, Non-GMO, Soy Free",Sports Research,27.95,0.3106,90,4.7,60344,2026-06-21T02:40:38Z
2,B07QHP2ZNQ,"Nordic Naturals Ultimate Omega, Lemon Flavor - 210 Soft Gels - 1280 mg Omega-3 - High-Potency Fish Oil with EPA & DHA - Promotes Brain & Heart Health - Non-GMO - 105 Servings",Nordic Naturals,72.21,0.3439,210,4.7,58932,2026-06-21T02:40:38Z
3,B000NPYY04,"Nature's Bounty Fish Oil Omega 3 Supplements - Supports Heart Health, 1200 Mg Fish Oil, Omega-3, 200 Softgels (Pack of 1)",Nature's Bounty,13.99,0.0699,200,4.7,75437,2026-06-21T02:40:38Z
4,B01NBTJFJB,Triple Strength Omega 3 Fish Oil 3600 mg | EPA & DHA | Over 2100mg Omega-3 Fatty Acids | 1300mg EPA + 860mg DHA | Best Essential Fatty Acids | Premium Wild Caught & Burpless Fish Oil | 120 Ct,,34.95,0.2913,120,4.6,29762,2026-06-21T02:40:38Z
5,B071VT9J98,"Nature Made Fish Oil Omega 3 Supplements, 1200 mg Softgels, Omega 3 Fish Oil for Healthy Heart Support, 230 Softgels, 115 Day Supply",Nature Made,15.33,0.0667,230,4.8,11027,2026-06-21T02:40:38Z
6,B075ZTY6GR,"Nordic Naturals Omega-3, Lemon Flavor - 90 Soft Gels - 690 mg Omega-3 - Fish Oil - EPA & DHA - Immune Support, Brain & Heart Health, Optimal Wellness - Non-GMO - 45 Servings",Nordic Naturals,22.49,0.2499,90,4.7,13414,2026-06-21T02:40:38Z
7,B0C5F59RWG,NatureWise Extra-Strength Omega 3 Fish Oil Supplement - 1000mg per Serving - 600 EPA & 400 DHA and Vitamin E - Sustainably Sourced Fish Oil - Lemon Flavor - 60 Softgels[1-Month Supply],NatureWise,7.99,0.1332,60,4.7,9426,2026-06-21T02:40:38Z
8,B014LDT0ZM,"Triple Strength Omega 3 Fish Oil Supplement for Men and Women – 2500 mg High-Potency, Easy-to-Absorb Re-esterified Triglyceride Form, Pescatarian-Friendly DPA EPA DHA Omega 3 Supplement, 180 Softgels",,53.95,0.2997,180,4.7,14047,2026-06-21T02:40:38Z
9,B0184SMS9A,"MegaRed Antarctic Krill Oil 500mg Omega 3 Fatty Acid Supplement, Extra Strength EPA & DHA Krill Oil Softgels (90cnt Box), Astaxanthin, Heart Health Supplement with No Fish Oil Aftertaste",MegaRed,26.88,,,4.8,8022,2026-06-21T02:40:38Z
10,B0046XC528,"Nature Made Fish Oil Omega 3 Supplements, 1000mg Softgels, Omega 3 Fish Oil for Healthy Heart Support, 250 Softgels, 125 Day Supply",Nature Made,19.59,0.0784,250,4.8,47475,2026-06-21T02:40:38Z
11,B098KLWZHN,"Nutricost Omega 3 Fish Oil - 2500MG, 120 Softgels (40 Serv) - Fish Oil, Wild Caught! 1200mg EPA 850mg DHA - Non-GMO, Gluten Free",Nutricost,20.95,0.1746,120,4.7,3380,2026-06-21T02:40:38Z
12,B0018CJ17W,"THORNE - Super EPA - Omega-3 Fish Oil Supplement with EPA & DHA from Sustainably Sourced Fish - Supports Brain, Skin, Joint & Heart Health* - Third-Party Certified - Gluten & Dairy-Free - 90 Softgels",Thorne,41.0,0.4556,90,4.6,3090,2026-06-21T02:40:38Z
13,B001GCU6KA,"NOW Foods Supplements, Omega-3 180 EPA / 120 DHA, Molecularly Distilled, Cardiovascular Support*, 200 Softgels",NOW Foods,14.27,0.0713,200,4.7,16356,2026-06-21T02:40:38Z
17,B06XPPP4M2,"Nordic Naturals Ultimate Omega 2X, Lemon Flavor - 120 Soft Gels - 2150 mg Omega-3 - High-Potency Fish Oil with EPA & DHA - Promotes Brain & Heart Health - Non-GMO - 60 Servings",Nordic Naturals,83.26,0.6938,120,4.6,5900,2026-06-21T02:40:38Z
18,B07V9P1L27,"Nordic Naturals Ultimate Omega-D3, Lemon Flavor - 90 Soft Gels - 1280 mg Omega-3 + 1000 IU Vitamin D3 - EPA & DHA - Promotes Brain, Heart, & Immune Health - 45 Servings",Nordic Naturals,37.36,0.4151,90,4.7,8204,2026-06-21T02:40:38Z
19,B07BBNGPG2,"Amazon Basics Fish Oil 303 mg, Soft Chew Gummies, Lemon, Orange & Strawberry-Banana Flavors, 90 Count, EPA and DHA Omega-3 Fatty Acids (Previously Solimo)",Amazon Basics,8.09,0.0899,90,4.6,8780,2026-06-21T02:40:38Z
20,B07WMZTX28,"Nordic Naturals Zero Sugar Children’s DHA Gummy Chews, Tropical Punch - 30 Gummy Chews for Kids - 600 mg Total Omega-3s - Brain Development, Learning, Healthy Immunity - Non-GMO - 30 Servings",Nordic Naturals,17.67,0.589,30,4.5,5314,2026-06-21T02:40:38Z
21,B07V9NZX7N,"Nordic Naturals Ultimate Omega Jr., Strawberry - 120 Mini Soft Gels - 680 Total Omega-3s with EPA & DHA - Brain Health, Mood, Learning - Non-GMO - 60 Servings",Nordic Naturals,34.81,0.5802,60,4.7,5468,2026-06-21T02:40:38Z
22,B07L45XQBR,"Micro Ingredients Triple Strength Omega 3 Fish Oil Supplements 4200mg Per Serving, 240 Softgels – Lemon Flavored – Burpless | EPA 1200mg + DHA 900mg | Deep Sea Fish",,33.99,0.1416,240,4.6,10859,2026-06-21T02:40:38Z
23,B09SRB8BXP,"Nature Made Extra Strength Burp Less Fish Oil Omega 3 Supplements 1400 mg Minis, Omega 3 Fish Oil as Ethyl Esters for Healthy Heart Brain Eyes Support, 60 Softgels, 30 Day Supply",Nature Made,13.49,0.2248,60,4.6,4971,2026-06-21T02:40:38Z
25,B002QMB55Y,"Nature's Bounty Odorless Fish Oil, 1200mg Omega-3 per Serving Including EPA & DHA, Supports Heart Health, Purified to Eliminate Mercury, Coated Softgels, Gluten Free, No Shellfish, 90 Ct",Nature's Bounty,14.49,0.161,90,4.7,9851,2026-06-21T02:40:38Z
27,B008NC7QQS,"Nature Made Extra Strength Flaxseed Oil 1400 mg, Fish Free Omega 3 Supplement, Dietary Supplement for Heart Health Support, 100 Softgels, 100 Day Supply",Nature Made,13.16,0.1316,100,4.7,13554,2026-06-21T02:40:38Z
29,B00CAZAU62,Dr. Tobias Omega 3 Fish Oil 2000mg Triple Strength with 800mg EPA 600mg DHA Per Serving | Fish Oil Omega 3 Supplements for Heart Brain & Immune Support - 180 Softgels (90 Servings),Dr. Tobias,39.99,0.2222,180,4.6,36813,2026-06-21T02:40:38Z
30,B0BDMTY4D8,THORNE - Prenatal DHA - 650 mg DHA and 200 mg of EPA - Supports Baby’s Brain & Nervous System Development from Pregnancy to Nursing* - 30 Servings,Thorne,29.41,0.9803,30,4.6,934,2026-06-21T02:40:38Z
25,B003PRMACQ,"Barlean's Omega 3 Fish Oil Liquid Supplement with Vitamin D for Men and Women, 1080mg of EPA and DHA Fatty Acid, Promotes Brain & Heart Health - Non-GMO, Mango Peach, 16 oz",Barlean's,,,,4.6,6266,2026-06-21T02:40:42Z
26,B01DCHM1UE,"MegaRed Omega 3 Fish Oil & Antarctic Krill Oil Softgels for Brain, Heart, Joints & Eye Support, (80 Count Bottle), Concentrated Omega 3 Fatty Acid Supplement with EPA, DHA, Phospholipids",MegaRed,,,80,4.7,13414,2026-06-21T02:40:42Z
27,B000SE5SY6,"NOW Foods Supplements, Ultra Omega-3 Molecularly Distilled and Enteric Coated, 180 Softgels",NOW Foods,,,180,4.8,4220,2026-06-21T02:40:42Z
28,B006P4B43W,"Life Extension Super Omega-3 EPA/DHA Fish Oil, Sesame Lignans & Olive Extract – Heart Health, Brain Health, Inflammation Health Support, Gluten-Free, Easy to Swallow, Non-GMO, 240 Softgels",Life Extension,,,240,4.5,5557,2026-06-21T02:40:42Z
29,B005D0DSLA,"Vitafusion Omega-3 Gummy Vitamins, Berry Lemonade Flavored, Heart Health Vitamins(1) With Omega 3 EPA/DHA and Vitamins A, C, D and E, America’s Number 1 Vitamin Brand, 60 Day Supply, 120 Count",,,,120,4.6,12485,2026-06-21T02:40:42Z
30,B0B523YQS7,"Qunol Fish Oil Omega 3 Mini Softgels, 1000mg Omega 3 EPA + DHA, Ultra Pure Supplements, Heart Health Support, Lemon Flavor, Easy to Swallow Minis, 3 Month Supply, 180 Count",Qunol,,,180,4.6,5005,2026-06-21T02:40:42Z
31,B07BH41QJQ,Pure Encapsulations EPA/DHA Essentials - Fish Oil Concentrate Supplement to Support Cardiovascular Health* - Premium EPA & DHA Supplement with Omega 3-90 Softgel Capsules,Pure Encapsulations,,,90,4.7,1664,2026-06-21T02:40:42Z
32,B08NXT9T9M,"Bronson Antarctic Krill Oil 2000mg with Omega-3s EPA, DHA, Astaxanthin and Phospholipids 120 Softgels",Bronson,,,120,4.6,6913,2026-06-21T02:40:42Z
33,B003PGJM00,"Nature Made Triple Omega 3 6 9 Supplements, Flaxseed, Safflower & Olive Oils, Fish Free Omega 3 Fatty Acid Supplement, 150 Softgels, 75 Day Supply",Nature Made,,,150,4.7,10248,2026-06-21T02:40:42Z
34,B092LLQ9DJ,"Momentous Omega-3 Fish Oil - High-Potency EPA & DHA Supplement for Men & Women - Supports Heart, Joint, & Brain Health - NSF Certified for Sport - Non-GMO - Gluten-Free - 1,600 mg - 30 Servings",,,,30,4.5,459,2026-06-21T02:40:42Z
35,B01LTHMG4A,"Nordic Naturals Ultimate Omega + CoQ10, Lemon - 120 Soft Gels - 1280 mg Omega-3 + 100 mg CoQ10 - Heart Health, Cellular Energy, Antioxidant Support - Non-GMO - 60 Servings",Nordic Naturals,,,120,4.8,3329,2026-06-21T02:40:42Z
36,B081VWWGCZ,"Carlson - Elite Omega-3 Gems, 1600 mg Omega-3 Fatty Acids Including EPA and DHA, Norwegian, Wild-Caught Fish Oil Supplement, Sustainably Sourced Omega 3 Fish Oil Capsules, Lemon, 130 Softgels",Carlson,,,130,4.8,2155,2026-06-21T02:40:42Z
37,B001LF39RE,"Carlson - The Very Finest Fish Oil, 1600 mg Omega-3s, Liquid Fish Oil Supplement, Norwegian Fish Oil, Wild-Caught, Sustainably Sourced Fish Oil Liquid, Lemon, 200ml, 6.7 Fl Oz",Carlson,,,,4.8,7501,2026-06-21T02:40:42Z
39,B00014D08Y,"Carlson - Cod Liver Oil, 1100 mg Omega-3s, Liquid Fish Oil Supplement, Wild-Caught Norwegian Arctic, Sustainably Sourced Nordic Liquid, Lemon, 250 ml",Carlson,,,,4.8,11992,2026-06-21T02:40:42Z
40,B01EVITLHE,Purity Products Omega 3-6-9 Vegan and Vegetarian Formula - “5 in 1” Essential Fatty Acid Complex - Scientifically Formulated Plant-Based Omega 3 6 9 Essential Fatty Acids (EFA) - from (60),Purity Products,,,,4.7,4762,2026-06-21T02:40:42Z
41,B07VF9HB74,"Nordic Naturals DHA Xtra, Strawberry - 90 Soft Gels - 1660 mg Omega-3 - High-Intensity DHA Formula for Brain & Nervous System Support - Non-GMO - 45 Servings",Nordic Naturals,,,90,4.7,3619,2026-06-21T02:40:42Z
42,B00126FELQ,"Nature Made Flaxseed Oil 1000 mg, Fish Free Omega 3 Supplement, Dietary Supplement for Heart Health Support, 100 Softgels, 100 Day Supply",Nature Made,,,100,4.7,7799,2026-06-21T02:40:42Z
43,B0758338B2,"Nordic Naturals Ultimate Omega 2X Teen, Strawberry - 60 Mini Soft Gels - 1120 mg Total Omega-3s with EPA & DHA - Brain Health, Positive Mood, Social Development, Learning - Non-GMO - 30 Servings",Nordic Naturals,,,30,4.8,2563,2026-06-21T02:40:42Z
44,B07H9GL3Y8,"Freshfield Vegan Omega 3, Algae (Algal) Oil, Fish Oil Free Company, Third Party Tested, Carrageenan Free, DHA Supplement w/DPA, Plant Based Omega. Supports Heart, Brain, Joint Health",Freshfield,,,,4.6,10768,2026-06-21T02:40:42Z
45,B0FS5MPD63,"Nature Made Fish Oil Omega 3 Supplements, 2000mg Per Serving Softgels, Omega 3 Fish Oil for Heart Health Support, 250 Softgels",Nature Made,,,250,4.8,455,2026-06-21T02:40:42Z
46,B076CQXRND,"Zhou Organic Black Seed Oil - Black Cumin Seed Oil Cold Pressed, Nigella Sativa, Pure Unrefined Blackseed Liquid, Premium Supplement for Health with Thymoquinone, Omega 3 6 9 - 8 Fl Oz (Pack of 1)",Zhou,,,,4.5,25075,2026-06-21T02:40:42Z
47,B0CXZHJXHV,"Nature's Bounty Omega 3, Plant-Based Omega 3 Fatty Acid Supplement, 520mg, Supports Whole Body Health Including Heart, Skin, Joint, 30 Vegetarian Softgels, Fish Oil Alternative",Nature's Bounty,,,,4.7,695,2026-06-21T02:40:42Z
49,B004BKR31E,"SEABUCKWONDERS Organic Sea Buckthorn Oil Omega-7 Complete, 120 Softgels, 60 Day Supply, with Omega 3, 6 & 9, Supports Hair, Skin & Nails, 100% Pure with Zero Filler Oil",,,,120,4.6,4956,2026-06-21T02:40:42Z
50,B076ZXJZ6G,"Prime Natural Organic Black Seed Oil 4oz - Cold Pressed Unrefined High Thymoquinone 1.7% USDA Certified - Turkish Origin Potent Nigella Sativa Liquid - Vegan Omega 3 6 9, Antioxidant",,,,,4.5,13092,2026-06-21T02:40:42Z
51,B01MCWCO2Y,"Bronson Antarctic Krill Oil 1000 mg with Omega-3s, 120 Softgels | Heavy Metal Tested, with EPA, DHA, Astaxanthin and Phospholipids, Non-GMO, Gluten Free, Soy Free",Bronson,,,120,4.6,14960,2026-06-21T02:40:42Z
52,B00N55ASK4,"Barlean's Organic Flaxseed Oil Liquid from Fresh Cold Pressed Flax Seeds, 7,640mg ALA Omega 3 Fatty Acid Supplement for Skin and Hair Care, Vegan & Gluten Free, 8 oz",Barlean's,,,,4.6,12751,2026-06-21T02:40:42Z
53,B0B71Z69WK,"Livingood Daily Omega 3 6 9 Plus Turmeric Curcumin Supplement, 60 Softgels",Livingood,,,60,4.6,2313,2026-06-21T02:40:42Z
