rank,asin,title,brand,price,unit_price,count,rating,review_count,timestamp
1,B0739KKHWL,"Nordic Naturals Ultimate Omega, Lemon Flavor - 90 Soft Gels - 1280 mg Omega-3 - High-Potency Omega-3 Fish Oil Supplement with EPA & DHA - Promotes Brain & Heart Health - Non-GMO - 45 Servings",Nordic Naturals,33.74,0.3749,90,4.7,58283,2026-04-29T01:58:38Z
2,B07DX89ZHN,Sports Research® Omega-3 Fish Oil 1250 - Triple Strength Fish Oil Supplement from Wild Alaska Pollock - MSC Certified Sustainable · Non-GMO · Soy Free - 90 Softgel Capsules,Sports Research,27.95,0.3106,90,4.7,59057,2026-04-29T01:58:38Z
3,B000NPYY04,"Nature's Bounty Fish Oil Omega 3 Supplements - Supports Heart Health, 1200 Mg Fish Oil, Omega-3, 200 Softgels (Pack of 1)",Nature's Bounty,13.99,0.0699,200,4.7,74808,2026-04-29T01:58:38Z
4,B01NBTJFJB,Triple Strength DHA Omega 3 Fish Oil 3600 mg | Over 2100mg Omega-3 Fatty Acids with 860mg of DHA | 1300mg EPA | Best Essential Fatty Acids | Premium Wild Caught & Burpless Fish Oil | 120 ct.,,34.95,0.2913,120,4.6,29096,2026-04-29T01:58:38Z
5,B071VT9J98,"Nature Made Fish Oil Omega 3 Supplements, 1200 mg Softgels, Omega 3 Fish Oil for Healthy Heart Support, 230 Softgels, 115 Day Supply",Nature Made,14.56,0.0633,230,4.8,10665,2026-04-29T01:58:38Z
6,B0C5F59RWG,"NatureWise Extra-Strength Omega 3 Fish Oil Supplement - 1000mg per Serving - 600 EPA & 400 DHA and Vitamin E - Support for Heart & Brain Health - Lemon Flavor, GMO-Free - 60 Softgels[1-Month Supply]",NatureWise,9.74,0.1623,60,4.7,8636,2026-04-29T01:58:38Z
7,B014LDT0ZM,"Triple Strength Omega 3 Fish Oil Supplement for Men and Women – 2500 mg High-Potency, Easy-to-Absorb Re-esterified Triglyceride Form, Pescatarian-Friendly DPA EPA DHA Omega 3 Supplement, 180 Softgels",,54.95,0.3053,180,4.7,13687,2026-04-29T01:58:38Z
8,B01BHF3KRG,"Micro Ingredients Pumpkin Seed Oil with Saw Palmetto,300 Softgels | Cold Pressed, Pure Virgin Oil, Essential Fatty Acids, & Phytosterols | Non-GMO",,27.96,0.0932,300,4.5,4964,2026-04-29T01:58:38Z
9,B098KLWZHN,"Nutricost Omega 3 Fish Oil - 2500MG, 120 Softgels (40 Serv) - Fish Oil, Wild Caught! 1200mg EPA 850mg DHA - Non-GMO, Gluten Free",Nutricost,19.95,0.1662,120,4.7,3032,2026-04-29T01:58:38Z
10,B0184SMS9A,"MegaRed Antarctic Krill Oil 500mg Omega 3 Fatty Acid Supplement, Extra Strength EPA & DHA Krill Oil Softgels (90cnt Box), Astaxanthin, Heart Health Supplement with No Fish Oil Aftertaste",MegaRed,26.88,,,4.8,7825,2026-04-29T01:58:38Z
11,B075ZTY6GR,"Nordic Naturals Omega-3, Lemon Flavor - 90 Soft Gels - 690 mg Omega-3 - Fish Oil - EPA & DHA - Immune Support, Brain & Heart Health, Optimal Wellness - Non-GMO - 45 Servings",Nordic Naturals,22.49,0.2499,90,4.7,13148,2026-04-29T01:58:38Z
12,B0018CJ17W,"THORNE - Super EPA - Omega-3 Fish Oil Supplement with EPA & DHA from Sustainably Sourced Fish - Supports Brain, Skin, Joint & Heart Health* - Third-Party Certified - Gluten & Dairy-Free - 90 Softgels",Thorne,41.0,0.4556,90,4.6,2963,2026-04-29T01:58:38Z
14,B07BBNGPG2,"Amazon Basics Fish Oil 303 mg, Soft Chew Gummies, Lemon, Orange & Strawberry-Banana Flavors, 90 Count, EPA and DHA Omega-3 Fatty Acids (Previously Solimo)",Amazon Basics,6.74,0.0749,90,4.6,8621,2026-04-29T01:58:38Z
15,B001GCU6KA,"NOW Foods Supplements, Omega-3 180 EPA / 120 DHA, Molecularly Distilled, Cardiovascular Support*, 200 Softgels",NOW Foods,14.69,0.0735,200,4.7,15915,2026-04-29T01:58:38Z
16,B06XPPP4M2,"Nordic Naturals Ultimate Omega 2X, Lemon Flavor - 120 Soft Gels - 2150 mg Omega-3 - High-Potency Fish Oil with EPA & DHA - Promotes Brain & Heart Health - Non-GMO - 60 Servings",Nordic Naturals,83.26,0.6938,120,4.6,5734,2026-04-29T01:58:38Z
17,B09SRB8BXP,"Nature Made Extra Strength Burp Less Fish Oil Omega 3 Supplements 1400 mg Minis, Omega 3 Fish Oil as Ethyl Esters for Healthy Heart Brain Eyes Support, 60 Softgels, 30 Day Supply",Nature Made,13.49,0.2248,60,4.6,4844,2026-04-29T01:58:38Z
18,B07WMZTX28,"Nordic Naturals Zero Sugar Children’s DHA Gummy Chews, Tropical Punch - 30 Gummy Chews for Kids - 600 mg Total Omega-3s - Brain Development, Learning, Healthy Immunity - Non-GMO - 30 Servings",Nordic Naturals,17.67,0.589,30,4.5,5173,2026-04-29T01:58:38Z
21,B00YMSLAW8,"Nature Made Fish Oil Omega 3 Supplements, 1000 mg Softgels, Omega 3 Fish Oil for Healthy Heart Support, 90 Softgels, 45 Day Supply",Nature Made,9.67,0.1074,90,4.8,47101,2026-04-29T01:58:38Z
22,B07V9NZX7N,"Nordic Naturals Ultimate Omega Jr., Strawberry - 120 Mini Soft Gels - 680 Total Omega-3s with EPA & DHA - Brain Health, Mood, Learning - Non-GMO - 60 Servings",Nordic Naturals,34.81,0.5802,60,4.7,5378,2026-04-29T01:58:38Z
23,B07L45XQBR,"Micro Ingredients Triple Strength Omega 3 Fish Oil Supplements 4200mg Per Serving, 240 Softgels – Lemon Flavored – Burpless | EPA 1200mg + DHA 900mg | Deep Sea Fish",,33.99,0.1416,240,4.6,10692,2026-04-29T01:58:38Z
25,B07BFSJLKX,"Amazon Elements Super Omega-3, Wild-Caught Fish Oil, Natural Lemon Flavor, EPA & DHA Omega-3 Fatty Acids, 1280 mg per Serving, 120 Softgels (Packaging may vary)",,13.49,0.1124,120,4.4,6804,2026-04-29T01:58:38Z
26,B002CQU550,"Nordic Naturals Ultimate Omega-D3, Lemon Flavor - 120 Soft Gels - 1280 mg Omega-3 + 1000 IU Vitamin D3 - EPA & DHA - Promotes Brain, Heart, & Immune Health - 60 Servings",Nordic Naturals,47.56,0.3963,120,4.7,8143,2026-04-29T01:58:38Z
27,B00CAZAU62,Dr. Tobias Omega 3 Fish Oil 2000mg Triple Strength with 800mg EPA 600mg DHA Per Serving | Fish Oil Omega 3 Supplements for Heart Brain & Immune Support - 180 Softgels (90 Servings),Dr. Tobias,39.99,0.2222,180,4.6,36821,2026-04-29T01:58:38Z
29,B002WTCLGI,"Nordic Naturals Children’s DHA, Strawberry - 8 oz for Kids - 530 mg Omega-3 with EPA & DHA - Brain Development & Function - Non-GMO - 96 Servings",Nordic Naturals,29.71,0.3095,96,4.6,10252,2026-04-29T01:58:38Z
25,B081VWWGCZ,"Carlson - Elite Omega-3 Gems, 1600 mg Omega-3 Fatty Acids Including EPA and DHA, Norwegian, Wild-Caught Fish Oil Supplement, Sustainably Sourced Omega 3 Fish Oil Capsules, Lemon, 130 Softgels",Carlson,42.42,0.3263,130,4.8,2125,2026-04-29T01:58:43Z
26,B01LTHMG4A,"Nordic Naturals Ultimate Omega + CoQ10, Lemon - 120 Soft Gels - 1280 mg Omega-3 + 100 mg CoQ10 - Heart Health, Cellular Energy, Antioxidant Support - Non-GMO - 60 Servings",Nordic Naturals,59.6,0.4967,120,4.8,3258,2026-04-29T01:58:43Z
27,B0C294XR2L,Horbäach Pumpkin Seed Oil 3000mg | 120 Softgel Capsules | Essential Fatty Acids with Omega 6 and 9 | Cold Pressed Dietary Supplement | Non-GMO and Gluten Free Formula,Horbäach,9.99,0.0833,120,4.5,2707,2026-04-29T01:58:43Z
28,B07GSGWZMB,"Carlyle Antarctic Krill Oil 2000mg | 120 Softgels | Omega-3 EPA, DHA, with Astaxanthin Supplement Sourced from Red Krill | Maximum Strength | Laboratory Tested",Carlyle,19.78,0.1648,120,4.5,20407,2026-04-29T01:58:43Z
29,B006P4B43W,"Life Extension Super Omega-3 EPA/DHA Fish Oil, Sesame Lignans & Olive Extract – Heart Health, Brain Health, Inflammation Health Support, Gluten-Free, Easy to Swallow, Non-GMO, 240 Softgels",Life Extension,27.75,0.1156,240,4.5,5447,2026-04-29T01:58:43Z
30,B00014D08Y,"Carlson - Cod Liver Oil, 1100 mg Omega-3s, Liquid Fish Oil Supplement, Wild-Caught Norwegian Arctic, Sustainably Sourced Nordic Liquid, Lemon, 250 ml",Carlson,31.37,,,4.8,11911,2026-04-29T01:58:43Z
31,B01DCHM1UE,MegaRed Omega-3 Fish Oil + High Absorption Krill Oil 500mg Softgels (80 Count (Pack of 1)),MegaRed,29.97,0.3746,80,4.7,13338,2026-04-29T01:58:43Z
32,B0758338B2,"Nordic Naturals Ultimate Omega 2X Teen, Strawberry - 60 Mini Soft Gels - 1120 mg Total Omega-3s with EPA & DHA - Brain Health, Positive Mood, Social Development, Learning - Non-GMO - 30 Servings",Nordic Naturals,31.41,1.047,30,4.7,2489,2026-04-29T01:58:43Z
33,B00UG078PE,"Metagenics OmegaGenics Omega-3 Fish Oil 1000mg EPA DHA -High Potency Omega 3 Supplement for Heart, Brain & Joint Health-Sustainably Sourced- 60 Softgels",Metagenics,48.75,0.8125,60,4.6,1539,2026-04-29T01:58:43Z
34,B07H9GL3Y8,"Freshfield Vegan Omega 3, Algae (Algal) Oil, Fish Oil Free Company, Third Party Tested, Carrageenan Free, DHA Supplement w/DPA, Plant Based Omega. Supports Heart, Brain, Joint Health",Freshfield,25.99,,,4.6,10730,2026-04-29T01:58:43Z
35,B0FS5MPD63,"Nature Made Fish Oil Omega 3 Supplements, 2000mg Per Serving Softgels, Omega 3 Fish Oil for Healthy Heart Support, 250 Softgels, 125 Day Supply",Nature Made,21.72,0.0869,250,4.7,340,2026-04-29T01:58:43Z
36,B07BH41QJQ,Pure Encapsulations EPA/DHA Essentials - Fish Oil Concentrate Supplement to Support Cardiovascular Health - Premium EPA & DHA Supplement with Omega 3-90 Softgel Capsules,Pure Encapsulations,41.5,0.4611,90,4.7,1632,2026-04-29T01:58:43Z
37,B092LLQ9DJ,"Momentous Omega-3 Fish Oil - High-Potency EPA & DHA Supplement for Men & Women - Supports Heart, Joint, & Brain Health - NSF Certified for Sport - Non-GMO - Gluten-Free - 1,600 mg - 30 Servings",,39.95,1.3317,30,4.6,426,2026-04-29T01:58:43Z
39,B076CQXRND,"Zhou Organic Black Seed Oil - Black Cumin Seed Oil Cold Pressed, Nigella Sativa, Pure Unrefined Blackseed Liquid, Premium Supplement for Health with Thymoquinone, Omega 3 6 9 - 8 Fl Oz (Pack of 1)",Zhou,20.89,,,4.5,24964,2026-04-29T01:58:43Z
40,B09GYWZ2LP,"Icelandic Wild Caught Cod Liver Oil Softgels - Fish Omega 3, EPA, DHA, Vitamin D & A, 1000mg Per Serving - Burpless Capsules for Heart, Joint, Brain & Immune Support - 100 Count",Icelandic,15.99,0.1599,100,4.7,3910,2026-04-29T01:58:43Z
41,B01EVITLHE,Purity Products Omega 3-6-9 Vegan and Vegetarian Formula - “5 in 1” Essential Fatty Acid Complex - Scientifically Formulated Plant-Based Omega 3 6 9 Essential Fatty Acids (EFA) - from (60),Purity Products,15.95,,,4.7,4661,2026-04-29T01:58:43Z
42,B08NXT9T9M,"Bronson Antarctic Krill Oil 2000 mg with Omega-3s EPA, DHA, Astaxanthin and Phospholipids 120 Softgels (60 Servings)",Bronson,19.97,0.1664,120,4.6,6816,2026-04-29T01:58:43Z
43,B076ZXJZ6G,"Prime Natural Organic Black Seed Oil 4oz - Cold Pressed Unrefined High Thymoquinone 1.7% USDA Certified - Turkish Origin Potent Nigella Sativa Liquid - Vegan Omega 3 6 9, Antioxidant",,19.99,,,4.5,12901,2026-04-29T01:58:43Z
44,B001LF39RO,"Carlson - The Very Finest Fish Oil, 1600 mg Omega-3s, Liquid Supplement, Norwegian, Wild-Caught, Sustainably Sourced , Lemon, 16.9 Fl Oz",Carlson,59.42,,,4.7,7385,2026-04-29T01:58:43Z
45,B00N55ASK4,"Barlean's Organic Flaxseed Oil Liquid from Fresh Cold Pressed Flax Seeds, 7,640mg ALA Omega 3 Fatty Acid Supplement for Skin and Hair Care, Vegan & Gluten Free, 8 oz",Barlean's,13.04,,,4.6,12605,2026-04-29T01:58:43Z
47,B01MCWCO2Y,"Bronson Antarctic Krill Oil 1000 mg with Omega-3s EPA, DHA, Astaxanthin and Phospholipids 120 Softgels",Bronson,27.99,0.2332,120,4.6,14946,2026-04-29T01:58:43Z
48,B00126FELQ,"Nature Made Flaxseed Oil 1000 mg, Fish Free Omega 3 Supplement, Dietary Supplement for Heart Health Support, 100 Softgels, 100 Day Supply",Nature Made,10.75,0.1075,100,4.7,7728,2026-04-29T01:58:43Z
49,B0714CYKXR,"Nature Made Fish Oil Omega 3 Supplements, Omega 3 Fish Oil as Ethyl Esters 1200 mg Softgels, EPA DHA Supplement for Healthy Heart, Brain, Eye Support, One Per Day, 100 Softgels",Nature Made,12.49,0.1249,100,4.8,1933,2026-04-29T01:58:43Z
50,B07VF9HB74,"Nordic Naturals DHA Xtra, Strawberry - 90 Soft Gels - 1660 mg Omega-3 - High-Intensity DHA Formula for Brain & Nervous System Support - Non-GMO - 45 Servings",Nordic Naturals,39.06,0.434,90,4.7,3591,2026-04-29T01:58:43Z
51,B0B71Z69WK,"Livingood Daily Omega 3 6 9 Plus Turmeric Curcumin Supplement, 60 Softgels - Fish Oil Omega 3 Supplements (EPA & DHA) for Men and Women - Brain, Joint, Heart Health, and Metabolism - Made in USA",Livingood,39.95,0.6658,60,4.6,2231,2026-04-29T01:58:43Z
52,B003PGJM00,"Nature Made Triple Omega 3 6 9 Supplements, Flaxseed, Safflower & Olive Oils, Fish Free Omega 3 Fatty Acid Supplement, 150 Softgels, 75 Day Supply",Nature Made,27.99,0.1866,150,4.7,10118,2026-04-29T01:58:43Z
53,B07B9MNCRH,"Live Conscious OmegaWell Omega 3 Fish Oil - 2000mg Capsules: Heart, Brain, & Joint Support - 800 mg EPA 600 mg DHA - Sustainably Sourced - Softgels - 30 Day Supply",Live Conscious,24.0,,,4.6,7440,2026-04-29T01:58:43Z
54,B0CWPY1XYN,"Qunol Advanced Omega 3 Krill and Fish Oil Complex, 10x Better Bioavailability, One Pill Dose, 250mg EPA & DHA, Supports Brain, Eye, Heart and Joint Health, 90 Count (Pack of 1)",Qunol,25.47,0.283,90,4.6,2996,2026-04-29T01:58:43Z
