rank,asin,title,brand,price,unit_price,count,rating,review_count,timestamp
51,B009KTUGSS,"Nordic Naturals Algae Omega - 120 Soft Gels - 715 mg Omega-3 - Certified Vegan Algae Oil - Plant-Based EPA & DHA - Heart, Eye, Immune & Brain Health - Non-GMO - 60 Servings",Nordic Naturals,45.01,0.3751,120,4.7,3527,2026-05-15T02:06:58Z
52,B0FDBHJ69J,"Omega 3 Fish Oil 3600 mg - Omega 3 Supplement | EPA & DHA - Heavy Metals Free - Heart, Brain & Joint Support - Purified Fish Oil for Men & Women - Lemon Flavored - Made in USA, 90 Softgels",,20.6,0.2289,90,4.7,659,2026-05-15T02:06:58Z
53,B0C294XR2L,Horbäach Pumpkin Seed Oil 3000mg | 120 Softgel Capsules | Essential Fatty Acids with Omega 6 and 9 | Cold Pressed Dietary Supplement | Non-GMO and Gluten Free Formula,Horbäach,9.99,0.0833,120,4.5,2788,2026-05-15T02:06:58Z
54,B081VWWGCZ,"Carlson - Elite Omega-3 Gems, 1600 mg Omega-3 Fatty Acids Including EPA and DHA, Norwegian, Wild-Caught Fish Oil Supplement, Sustainably Sourced Omega 3 Fish Oil Capsules, Lemon, 130 Softgels",Carlson,42.42,0.3263,130,4.8,2133,2026-05-15T02:06:58Z
55,B08NXT9T9M,"Bronson Antarctic Krill Oil 2000mg with Omega-3s EPA, DHA, Astaxanthin and Phospholipids 120 Softgels",Bronson,19.97,0.1664,120,4.6,6839,2026-05-15T02:06:58Z
56,B006P4B43W,"Life Extension Super Omega-3 EPA/DHA Fish Oil, Sesame Lignans & Olive Extract – Heart Health, Brain Health, Inflammation Health Support, Gluten-Free, Easy to Swallow, Non-GMO, 240 Softgels",Life Extension,27.75,0.1156,240,4.5,5489,2026-05-15T02:06:58Z
57,B00UG078PE,"Metagenics OmegaGenics Omega-3 Fish Oil 1000mg EPA DHA -High Potency Omega 3 Supplement for Heart, Brain & Joint Health-Sustainably Sourced- 60 Softgels",Metagenics,48.75,0.8125,60,4.7,1558,2026-05-15T02:06:58Z
58,B0758338B2,"Nordic Naturals Ultimate Omega 2X Teen, Strawberry - 60 Mini Soft Gels - 1120 mg Total Omega-3s with EPA & DHA - Brain Health, Positive Mood, Social Development, Learning - Non-GMO - 30 Servings",Nordic Naturals,31.41,1.047,30,4.7,2513,2026-05-15T02:06:58Z
59,B0B523YQS7,"Qunol Fish Oil Omega 3 Mini Softgels, 1000mg Omega 3 EPA + DHA, Ultra Pure Supplements, Heart Health Support, Lemon Flavor, Easy to Swallow Minis, 3 Month Supply, 180 Count",Qunol,25.99,0.1444,180,4.6,4814,2026-05-15T02:06:58Z
60,B07BH41QJQ,Pure Encapsulations EPA/DHA Essentials - Fish Oil Concentrate Supplement to Support Cardiovascular Health - Premium EPA & DHA Supplement with Omega 3-90 Softgel Capsules,Pure Encapsulations,41.5,0.4611,90,4.7,1641,2026-05-15T02:06:58Z
61,B092LLQ9DJ,"Momentous Omega-3 Fish Oil - High-Potency EPA & DHA Supplement for Men & Women - Supports Heart, Joint, & Brain Health - NSF Certified for Sport - Non-GMO - Gluten-Free - 1,600 mg - 30 Servings",,39.95,1.3317,30,4.6,437,2026-05-15T02:06:58Z
62,B000SE5SY6,"NOW Foods Supplements, Ultra Omega-3 Molecularly Distilled and Enteric Coated, 180 Softgels",NOW Foods,21.19,0.1177,180,4.8,4148,2026-05-15T02:06:58Z
63,B0CL8BF5FR,"Ritual Vegan Omega 3 Supplement - Science-Backed Dose of DHA and EPA - Bioavailable Omega-3 from Algae Oil - Brain, Heart, and Eye Health Support** - Citrus - 30 Capsules - 30 Servings",,24.75,0.825,30,4.6,543,2026-05-15T02:06:58Z
64,B002CQU532,"Nordic Naturals Ultimate Omega + CoQ10, Lemon - 60 Soft Gels - 1280 mg Omega-3 + 100 mg CoQ10 - Heart Health, Cellular Energy, Antioxidant Support - Non-GMO - 30 Servings",Nordic Naturals,33.11,0.5518,60,4.8,3273,2026-05-15T02:06:58Z
65,B01MCWCO2Y,"Bronson Antarctic Krill Oil 1000 mg with Omega-3s EPA, DHA, Astaxanthin and Phospholipids 120 Softgels",Bronson,27.99,0.2332,120,4.6,14947,2026-05-15T02:06:58Z
66,B08LR12HBM,"MARYRUTH'S Vegan Omega 3 Gummies for Kids 2+, 2 Month Supply, Sugar Free, Omega 3 Supplement with Vitamin C, Flaxseed Oil, Immune Support, Essential Nutrient ALA, No Fish Taste, 60 Count",,17.21,0.2868,60,4.6,1254,2026-05-15T02:06:58Z
67,B01EVITLHE,Purity Products Omega 3-6-9 Vegan and Vegetarian Formula - “5 in 1” Essential Fatty Acid Complex - Scientifically Formulated Plant-Based Omega 3 6 9 Essential Fatty Acids (EFA) - from (60),Purity Products,15.95,,,4.7,4693,2026-05-15T02:06:58Z
68,B001LF39RE,"Carlson - The Very Finest Fish Oil, 1600 mg Omega-3s, Liquid Fish Oil Supplement, Norwegian Fish Oil, Wild-Caught, Sustainably Sourced Fish Oil Liquid, Lemon, 200ml, 6.7 Fl Oz",Carlson,29.67,,,4.7,7421,2026-05-15T02:06:58Z
69,B076CQXRND,"Zhou Organic Black Seed Oil - Black Cumin Seed Oil Cold Pressed, Nigella Sativa, Pure Unrefined Blackseed Liquid, Premium Supplement for Health with Thymoquinone, Omega 3 6 9 - 8 Fl Oz (Pack of 1)",Zhou,20.89,,,4.5,24992,2026-05-15T02:06:58Z
70,B00N55ASK4,"Barlean's Organic Flaxseed Oil Liquid from Fresh Cold Pressed Flax Seeds, 7,640mg ALA Omega 3 Fatty Acid Supplement for Skin and Hair Care, Vegan & Gluten Free, 8 oz",Barlean's,14.49,,,4.6,12640,2026-05-15T02:06:58Z
71,B07H9GL3Y8,"Freshfield Vegan Omega 3, Algae (Algal) Oil, Fish Oil Free Company, Third Party Tested, Carrageenan Free, DHA Supplement w/DPA, Plant Based Omega. Supports Heart, Brain, Joint Health",Freshfield,25.99,,,4.6,10742,2026-05-15T02:06:58Z
72,B07VF9HB74,"Nordic Naturals DHA Xtra, Strawberry - 90 Soft Gels - 1660 mg Omega-3 - High-Intensity DHA Formula for Brain & Nervous System Support - Non-GMO - 45 Servings",Nordic Naturals,39.06,0.434,90,4.7,3601,2026-05-15T02:06:58Z
74,B076ZXJZ6G,"Prime Natural Organic Black Seed Oil 4oz - Cold Pressed Unrefined High Thymoquinone 1.7% USDA Certified - Turkish Origin Potent Nigella Sativa Liquid - Vegan Omega 3 6 9, Antioxidant",,19.99,,,4.5,12958,2026-05-15T02:06:58Z
75,B0FS5MPD63,"Nature Made Fish Oil Omega 3 Supplements, 2000mg Per Serving Softgels, Omega 3 Fish Oil for Healthy Heart Support, 250 Softgels, 125 Day Supply",Nature Made,29.59,0.1184,250,4.8,373,2026-05-15T02:06:58Z
76,B00014D08Y,"Carlson - Cod Liver Oil, 1100 mg Omega-3s, Liquid Fish Oil Supplement, Wild-Caught Norwegian Arctic, Sustainably Sourced Nordic Liquid, Lemon, 250 ml",Carlson,33.07,,,4.8,11938,2026-05-15T02:06:58Z
77,B0B71Z69WK,"Livingood Daily Omega 3 6 9 Plus Turmeric Curcumin Supplement, 60 Softgels - Fish Oil Omega 3 Supplements (EPA & DHA) for Men and Women - Brain, Joint, Heart Health, and Metabolism - Made in USA",Livingood,39.95,0.6658,60,4.6,2270,2026-05-15T02:06:58Z
78,B0CXZHJXHV,"Nature's Bounty Omega 3, Plant-Based Omega 3 Fatty Acid Supplement, 520mg, Supports Whole Body Health Including Heart, Skin, Joint, 30 Vegetarian Softgels, Fish Oil Alternative",Nature's Bounty,13.79,,,4.7,581,2026-05-15T02:06:58Z
79,B08SCHPNQM,"Oceanblue Professional Omega-3 2100 – 180 ct – Triple Strength Burpless Fish Oil Supplement with High-Potency EPA, DHA, DPA – Wild-Caught – Orange Flavor (90 Servings)",Oceanblue,49.95,0.2775,180,4.6,5876,2026-05-15T02:06:58Z
80,B0013L5G9U,"Nature’s Bounty Fish Oil, Supports Heart Health, 1000mg, Rapid Release Softgels, 145 Ct",,11.97,0.0826,145,4.8,5847,2026-05-15T02:06:58Z
